{
  "domain": "platform-gatekeeper-reporting",
  "version": 2,
  "as_of": "2026-09-23",
  "events": [
    {
      "id": "EVT-2026-03",
      "title": "大促期间排序规则 promo-rank v7 流量分发失真事件",
      "level": "large",
      "gatekeeper_domains": [
        "算法",
        "流量"
      ],
      "status": "closed",
      "first_observed_at": "2026-03-12T07:40:00",
      "filed_at": "2026-03-13T10:00:00",
      "filing_deadline": "2026-03-15T07:40:00",
      "filing_timeliness": "on_time",
      "filed_by": "合规负责人-周岚",
      "teams": [
        "商家治理团队",
        "流量分发团队"
      ],
      "reports": [
        "RPT-H01",
        "RPT-H02"
      ],
      "snapshot": {
        "window_start": "2026-03-12T00:30:00",
        "window_end": "2026-03-12T09:00:00",
        "rule_versions": [
          {
            "code": "promo-rank",
            "version": "v7",
            "note": "大促排序权重版本"
          },
          {
            "code": "traffic-shield",
            "version": "v2",
            "note": "流量异常兜底策略"
          }
        ],
        "affected_subjects": [
          {
            "type": "merchant_segment",
            "segment": "中小商家",
            "count": 9800
          },
          {
            "type": "consumer_orders",
            "count_estimate": 512000
          }
        ],
        "interim_measures": [
          {
            "measure": "暂停 promo-rank v7 新权重，回退至 v6 稳定版本",
            "at": "2026-03-12T09:10"
          },
          {
            "measure": "开通大促申诉绿色通道并优先核处",
            "at": "2026-03-12T10:00"
          }
        ],
        "frozen_by": "合规负责人-周岚",
        "frozen_at": "2026-03-13T11:00:00"
      },
      "snapshot_corrections": [],
      "tasks": [
        {
          "id": "TASK-0001",
          "code": "root_cause",
          "title": "定位 promo-rank v7 权重计算缺陷",
          "owner_team": "算法平台组",
          "due": "2026-03-20T18:00:00",
          "status": "done",
          "evidence_ids": [
            "EV-H01"
          ],
          "result_note": "权重归一化缺陷导致补贴敏感商家被系统性降权",
          "submitted_by": "算法-高衡",
          "submitted_at": "2026-03-20T10:00:00",
          "completed_at": "2026-03-20T15:00:00",
          "retest_results": []
        },
        {
          "id": "TASK-0002",
          "code": "user_remedy",
          "title": "对受影响商家补发流量券并逐单回访",
          "owner_team": "客户服务团队",
          "due": "2026-03-22T18:00:00",
          "status": "done",
          "evidence_ids": [
            "EV-H02"
          ],
          "result_note": "9800 户商家流量券补发完成，回访满意 96%",
          "submitted_by": "客服-叶宁",
          "submitted_at": "2026-03-22T17:30:00",
          "completed_at": "2026-03-23T09:00:00",
          "retest_results": []
        },
        {
          "id": "TASK-0003",
          "code": "policy_revision",
          "title": "修订排序规则发布与回滚管理办法",
          "owner_team": "合规与制度组",
          "due": "2026-03-26T18:00:00",
          "status": "done",
          "evidence_ids": [
            "EV-H01"
          ],
          "result_note": "管理办法增补发布前公平性评估条款",
          "submitted_by": "制度-方澄",
          "submitted_at": "2026-03-25T10:00:00",
          "completed_at": "2026-03-25T15:00:00",
          "retest_results": []
        },
        {
          "id": "TASK-0004",
          "code": "retest",
          "title": "灰度环境复测流量分发公平性指标",
          "owner_team": "质量保障组",
          "due": "2026-03-28T18:00:00",
          "status": "done",
          "evidence_ids": [
            "EV-H01"
          ],
          "result_note": "灰度 72 小时曝光基尼系数回到基线区间",
          "submitted_by": "测试-闻迪",
          "submitted_at": "2026-03-27T16:00:00",
          "completed_at": "2026-03-27T17:00:00",
          "retest_results": [
            {
              "passed": true,
              "by": "合规负责人-周岚",
              "at": "2026-03-27T17:00:00"
            }
          ]
        }
      ],
      "evidence": [
        {
          "id": "EV-H01",
          "title": "promo-rank v7 权重缺陷复盘报告",
          "kind": "root_cause_report",
          "ref": "docs://gatekeeper/2026/03/EV-H01",
          "sha256": "h1-aaaaaaaaaaaaaaaaaaaaaaaaaaaaaaaaaaaaaaaaaaaaaaaaaaaaaaaaaaaaaaaa",
          "controlled": false,
          "uploaded_by": "算法-高衡",
          "uploaded_at": "2026-03-19T16:00:00",
          "state": "approved",
          "reviews": [
            {
              "by": "审签-林绍",
              "decision": "approved",
              "note": "根因链条与数据复现完整",
              "at": "2026-03-19T17:00:00"
            },
            {
              "by": "审签-韩静",
              "decision": "approved",
              "note": "同意结论与改进方向",
              "at": "2026-03-20T09:00:00"
            }
          ],
          "supersedes": null
        },
        {
          "id": "EV-H02",
          "title": "受影响商家流量补偿执行清册",
          "kind": "remedy_ledger",
          "ref": "controlled://vault/2026/03/EV-H02",
          "sha256": "h2-bbbbbbbbbbbbbbbbbbbbbbbbbbbbbbbbbbbbbbbbbbbbbbbbbbbbbbbbbbbbbbbb",
          "controlled": true,
          "uploaded_by": "客服-叶宁",
          "uploaded_at": "2026-03-22T15:00:00",
          "state": "approved",
          "reviews": [
            {
              "by": "审签-林绍",
              "decision": "approved",
              "note": "受控清册与补偿口径一致",
              "at": "2026-03-22T16:00:00"
            },
            {
              "by": "审签-韩静",
              "decision": "approved",
              "note": "抽核 30 户无误",
              "at": "2026-03-22T17:00:00"
            }
          ],
          "supersedes": null
        }
      ],
      "commitments": [
        {
          "id": "CMT-H01",
          "statement": "2026 年二季度前将排序规则变更纳入双人复核与灰度观测",
          "owner_team": "算法平台组",
          "due": "2026-06-30T18:00:00",
          "created_at": "2026-03-23T10:00:00",
          "status": "verified",
          "verified_at": "2026-06-25T11:00:00",
          "verify_note": "复核流程与灰度看板已上线运行",
          "verified_by": "合规负责人-周岚",
          "evidence_ids": [
            "EV-H01"
          ]
        }
      ],
      "recurrence": {
        "prior": [],
        "followups": [
          {
            "event_id": "EVT-2026-09",
            "title": "排序规则回滚引发的商家申诉、价格补贴与流量歧视并发事件",
            "shared_rule_codes": [
              "promo-rank"
            ],
            "reason": "promo-rank 模块在发布管控失效后半年内再度引发流量分发失真，3 月事件承诺的双人复核未覆盖应急回滚快速通道",
            "by": "合规负责人-周岚",
            "at": "2026-09-11T16:00:00"
          }
        ]
      },
      "closed_at": "2026-06-26T10:00:00",
      "history": [
        {
          "at": "2026-03-13T10:00:00",
          "by": "合规负责人-周岚",
          "action": "graded_filing",
          "detail": "按较大级报送并归并 2 条上报"
        },
        {
          "at": "2026-03-13T11:00",
          "by": "合规负责人-周岚",
          "action": "freeze_snapshot",
          "detail": "冻结影响时间窗、规则版本、受影响主体与临时措施"
        },
        {
          "at": "2026-03-13T14:00",
          "by": "合规负责人-周岚",
          "action": "assign_task",
          "detail": "分派根因调查：定位 promo-rank v7 权重计算缺陷（算法平台组，期限 2026-03-20T18:00）"
        },
        {
          "at": "2026-03-13T14:00",
          "by": "合规负责人-周岚",
          "action": "assign_task",
          "detail": "分派用户补救：对受影响商家补发流量券并逐单回访（客户服务团队，期限 2026-03-22T18:00）"
        },
        {
          "at": "2026-03-13T14:00",
          "by": "合规负责人-周岚",
          "action": "assign_task",
          "detail": "分派制度修订：修订排序规则发布与回滚管理办法（合规与制度组，期限 2026-03-26T18:00）"
        },
        {
          "at": "2026-03-13T14:00",
          "by": "合规负责人-周岚",
          "action": "assign_task",
          "detail": "分派复测验证：灰度环境复测流量分发公平性指标（质量保障组，期限 2026-03-28T18:00）"
        },
        {
          "at": "2026-03-19T16:00",
          "by": "算法-高衡",
          "action": "add_evidence",
          "detail": "登记证据：EV-H01 promo-rank v7 权重缺陷复盘报告"
        },
        {
          "at": "2026-03-19T17:00",
          "by": "审签-林绍",
          "action": "review_evidence",
          "detail": "证据 EV-H01 审签：approved（待另一审批人签署）"
        },
        {
          "at": "2026-03-20T09:00",
          "by": "审签-韩静",
          "action": "review_evidence",
          "detail": "证据 EV-H01 审签：approved（双人双签完成）"
        },
        {
          "at": "2026-03-20T10:00",
          "by": "算法-高衡",
          "action": "submit_task",
          "detail": "根因调查结果提交审签"
        },
        {
          "at": "2026-03-20T15:00",
          "by": "合规负责人-周岚",
          "action": "complete_task",
          "detail": "根因调查办结"
        },
        {
          "at": "2026-03-22T15:00",
          "by": "客服-叶宁",
          "action": "add_evidence",
          "detail": "登记受控附件（商业秘密）：EV-H02 受影响商家流量补偿执行清册"
        },
        {
          "at": "2026-03-22T16:00",
          "by": "审签-林绍",
          "action": "review_evidence",
          "detail": "证据 EV-H02 审签：approved（待另一审批人签署）"
        },
        {
          "at": "2026-03-22T17:00",
          "by": "审签-韩静",
          "action": "review_evidence",
          "detail": "证据 EV-H02 审签：approved（双人双签完成）"
        },
        {
          "at": "2026-03-22T17:30",
          "by": "客服-叶宁",
          "action": "submit_task",
          "detail": "用户补救结果提交审签"
        },
        {
          "at": "2026-03-23T09:00",
          "by": "合规负责人-周岚",
          "action": "complete_task",
          "detail": "用户补救办结"
        },
        {
          "at": "2026-03-25T10:00",
          "by": "制度-方澄",
          "action": "submit_task",
          "detail": "制度修订结果提交审签"
        },
        {
          "at": "2026-03-25T15:00",
          "by": "合规负责人-周岚",
          "action": "complete_task",
          "detail": "制度修订办结"
        },
        {
          "at": "2026-03-27T16:00",
          "by": "测试-闻迪",
          "action": "submit_task",
          "detail": "复测验证结果提交审签"
        },
        {
          "at": "2026-03-27T17:00",
          "by": "合规负责人-周岚",
          "action": "complete_task",
          "detail": "复测验证办结（复测通过）"
        },
        {
          "at": "2026-03-23T10:00",
          "by": "合规负责人-周岚",
          "action": "add_commitment",